{
    "schema_version":  1,
    "source":  "Watcher expression overview",
    "imported_at":  "2026-08-05T03:41:56.6517450Z",
    "records":  [
                    {
                        "source_record_id":  "recbwadAdh",
                        "source_label":  "watcher-聆听",
                        "display_name":  "聆听",
                        "resource_id":  "listening",
                        "order":  0,
                        "gif":  "O0A4bN5Sbo8amOxgqHTc7lLAnBd",
                        "action":  "GMpPb7Uk4oJw22x2WkGcNccTnJb",
                        "sound":  null
                    },
                    {
                        "source_record_id":  "recvdwKxiUJZ7V",
                        "source_label":  "watcher-说话",
                        "display_name":  "说话",
                        "resource_id":  "speaking",
                        "order":  1,
                        "gif":  "P6cwbYKSCo7MC8x6pcNcw2gDnOF",
                        "action":  "ULLcbdLvcoFYugxox6xcEpGQnqh",
                        "sound":  null
                    },
                    {
                        "source_record_id":  "recvdwKxxte9bg",
                        "source_label":  "watcher-分析",
                        "display_name":  "分析",
                        "resource_id":  "processing",
                        "order":  2,
                        "gif":  "Bk0VbOw64oaWIgxDiyicqY0UnCe",
                        "action":  "VS5EbyhCSoh43qxdbu6cgj6znjc",
                        "sound":  null
                    },
                    {
                        "source_record_id":  "recvdwKxL7ppUo",
                        "source_label":  "watcher-睡觉",
                        "display_name":  "睡觉",
                        "resource_id":  "standby",
                        "order":  3,
                        "gif":  "IJgVbO26io2bjyxDwLWc9xM6nUs",
                        "action":  "LqVYbgh0QoDE05xsbYkcp1wrnhh",
                        "sound":  "EuXPbs10zok63CxDnUkcK4HWn2b"
                    },
                    {
                        "source_record_id":  "recvdwKxW8TQzA",
                        "source_label":  "watcher-工具",
                        "display_name":  "工具",
                        "resource_id":  "custom3",
                        "order":  4,
                        "gif":  "W2YUbZI3jowll3xaPlQcjnxgnIh",
                        "action":  "QL5Yb8lnXoIerOxouIhcAHDan4p",
                        "sound":  null
                    },
                    {
                        "source_record_id":  "recvdwKy91WjHK",
                        "source_label":  "watcher-错误",
                        "display_name":  "错误",
                        "resource_id":  "error",
                        "order":  5,
                        "gif":  "XCDMbMm4GoEuFjx0qKmcCq7Unde",
                        "action":  "H8RPbOJ6Fo6FuExwtGJcdkz3nfb",
                        "sound":  "RE8Kb288sov0kqxIc2GcEv1rn2e"
                    },
                    {
                        "source_record_id":  "recvdwKUdEP6OZ",
                        "source_label":  "watcher-成功",
                        "display_name":  "成功",
                        "resource_id":  "happy",
                        "order":  6,
                        "gif":  "TJRGbuHEuoFoVQxcDTXcN8Ufnyh",
                        "action":  "YGVubi48EoPtpsxJJzlc6HGenQf",
                        "sound":  "MbgqbsCBboJKGoxHTb8caTugnke"
                    },
                    {
                        "source_record_id":  "recvdwKVOautn8",
                        "source_label":  "watcher-爱心",
                        "display_name":  "爱心",
                        "resource_id":  "custom1",
                        "order":  7,
                        "gif":  "ZUZNbTNRhosKuExyBtucaUXmnTg",
                        "action":  null,
                        "sound":  null
                    },
                    {
                        "source_record_id":  "recvdwLdDj9jJm",
                        "source_label":  "watcher-执行",
                        "display_name":  "执行",
                        "resource_id":  "custom2",
                        "order":  8,
                        "gif":  "Uqcjb2NgYoF4Z6x9ux4celdIn2d",
                        "action":  null,
                        "sound":  null
                    },
                    {
                        "source_record_id":  "recvdxlLKRauKk",
                        "source_label":  "watcher-思考",
                        "display_name":  "思考",
                        "resource_id":  "thinking",
                        "order":  9,
                        "gif":  "FsPabO8YWoXIolxIKwCczGxen3M",
                        "action":  "HPHlbGSh0oymtZx6v2xckj5ynIU",
                        "sound":  "YS2xbmOxmojf9Vxeb7Kc4jUsnBl"
                    },
                    {
                        "source_record_id":  "recvdxn4mrrgzp",
                        "source_label":  "watcher-开机",
                        "display_name":  "开机",
                        "resource_id":  "boot",
                        "order":  10,
                        "gif":  "QQqgbwdiAoFKwBx21VPcHf7GnKh",
                        "action":  null,
                        "sound":  "IJf6bdcdDo7lhxxXzxccRumtnWb"
                    },
                    {
                        "source_record_id":  "recvdxn4DMRrnB",
                        "source_label":  "watcher-蓝牙",
                        "display_name":  "蓝牙",
                        "resource_id":  "bluetooth",
                        "order":  11,
                        "gif":  "KA4jb1uYiooz3GxJytWc8dbMnyb",
                        "action":  "Jf1KbRhJBouJb0xfjUKcQkQVnQ4",
                        "sound":  "L5i0b8E44ojVw2x1yeLcjj4inle"
                    },
                    {
                        "source_record_id":  "recvdxn4R6TqKS",
                        "source_label":  "watcher-断开蓝牙",
                        "display_name":  "断开蓝牙",
                        "resource_id":  "disconnect",
                        "order":  12,
                        "gif":  "RZKubl59lo50N3x3ApncvY3JnCh",
                        "action":  "LQlnbQPDroqMSVxqcb8cig7ZnUd",
                        "sound":  "SCrxbPNCEoPZJXxxAHtcVlwXneh"
                    },
                    {
                        "source_record_id":  "recvi2TAd9G4gY",
                        "source_label":  "watcher-感叹号",
                        "display_name":  "感叹号",
                        "resource_id":  "shock",
                        "order":  13,
                        "gif":  "NnycbZpNroq0NQx2NZ5cqaMIn4z",
                        "action":  "RnnNbml0MohKicxJO86cUwK6nzf",
                        "sound":  "DbPDbyDdWoynS2xGiS3cXHOOnwh"
                    },
                    {
                        "source_record_id":  "recvi2TAB2Pcnx",
                        "source_label":  "watcher-墨镜",
                        "display_name":  "墨镜",
                        "resource_id":  "sunglasses",
                        "order":  14,
                        "gif":  "R3QubHjBVoDzvyx8Okqca1B1njg",
                        "action":  "DA1ib8p3IoZnfJxlcv5czUZQnCc",
                        "sound":  null
                    },
                    {
                        "source_record_id":  "recvi2TAOYpVc3",
                        "source_label":  "watcher-伤心",
                        "display_name":  "伤心",
                        "resource_id":  "sad",
                        "order":  15,
                        "gif":  "CjjlbmwR1o0apwxpSOdcQEkJnhl",
                        "action":  "MKAqbeEXKochWfx9M5Qc5Z8Knnd",
                        "sound":  null
                    },
                    {
                        "source_record_id":  "recvi2TBg00IVq",
                        "source_label":  "watcher-收到",
                        "display_name":  "收到",
                        "resource_id":  "get",
                        "order":  16,
                        "gif":  "UT4xbYTfBoNLOgxTDdlcVV35n4g",
                        "action":  "XsZGbDrCjoBl0sxh2cxca7krnlc",
                        "sound":  "CxG3byP7VoFuvpxdzuqcHogHnvo"
                    },
                    {
                        "source_record_id":  "recvi2TBDZMYW9",
                        "source_label":  "watcher-微笑",
                        "display_name":  "微笑",
                        "resource_id":  "smile",
                        "order":  17,
                        "gif":  "L8hrb6mz2ogtyRxjfj0cEqzen3f",
                        "action":  "Ic5wbNFvfoYAurxWUvockiVAnBb",
                        "sound":  null
                    },
                    {
                        "source_record_id":  "recvi30buNF2qB",
                        "source_label":  "watcher-无线充电",
                        "display_name":  "无线充电",
                        "resource_id":  "recharge",
                        "order":  18,
                        "gif":  "B8EqbjYWvohncvxRqStc92rnnMd",
                        "action":  null,
                        "sound":  "FH0Mbu4IHovu28xUc6TckGrQnBp"
                    },
                    {
                        "source_record_id":  "recvi30bHMhwvH",
                        "source_label":  "watcher-无语",
                        "display_name":  "无语",
                        "resource_id":  "speechless",
                        "order":  19,
                        "gif":  "YIpGbvrcfoU1Dqx8g2dc0Vjhnng",
                        "action":  null,
                        "sound":  null
                    },
                    {
                        "source_record_id":  "recvi30bVhcK9k",
                        "source_label":  "watcher-专注",
                        "display_name":  "专注",
                        "resource_id":  "focus",
                        "order":  20,
                        "gif":  "Z7GPbZLf9ofQlyxuMMpc7qUPnZb",